[
  {
    "available": true,
    "id": "ability-002--weather--rain",
    "identity": true,
    "rule": {
      "parameters": {
        "duration": {
          "turns": 5
        }
      },
      "recipient": "field",
      "relation": "causes",
      "requirements": {
        "all": []
      },
      "source": {
        "collection": "abilities",
        "id": "ability-002"
      },
      "target": {
        "collection": "effects",
        "id": "rain"
      },
      "trigger": "on-entry"
    }
  },
  {
    "available": true,
    "id": "ability-033--benefits--rain",
    "identity": true,
    "rule": {
      "parameters": {
        "multiplier": 2,
        "stat": "speed"
      },
      "recipient": "self",
      "relation": "benefits",
      "requirements": {
        "all": [
          {
            "effectId": "rain",
            "predicate": "effect-active"
          }
        ]
      },
      "source": {
        "collection": "abilities",
        "id": "ability-033"
      },
      "target": {
        "collection": "effects",
        "id": "rain"
      },
      "trigger": "while-active"
    }
  },
  {
    "available": true,
    "id": "ability-034--benefits--harsh-sunlight",
    "identity": true,
    "rule": {
      "parameters": {
        "multiplier": 2,
        "stat": "speed"
      },
      "recipient": "self",
      "relation": "benefits",
      "requirements": {
        "all": [
          {
            "effectId": "harsh-sunlight",
            "predicate": "effect-active"
          }
        ]
      },
      "source": {
        "collection": "abilities",
        "id": "ability-034"
      },
      "target": {
        "collection": "effects",
        "id": "harsh-sunlight"
      },
      "trigger": "while-active"
    }
  },
  {
    "available": true,
    "id": "ability-036--copies--opponent",
    "identity": true,
    "rule": {
      "parameters": {},
      "recipient": "self",
      "relation": "copies",
      "requirements": {
        "all": [
          {
            "predicate": "source-is-opponent"
          }
        ]
      },
      "source": {
        "collection": "abilities",
        "id": "ability-036"
      },
      "target": {
        "collection": "abilities",
        "selector": {
          "property": "copyable"
        }
      },
      "trigger": "on-entry"
    }
  },
  {
    "available": true,
    "id": "ability-045--weather--sandstorm",
    "identity": true,
    "rule": {
      "parameters": {
        "duration": {
          "turns": 5
        }
      },
      "recipient": "field",
      "relation": "causes",
      "requirements": {
        "all": []
      },
      "source": {
        "collection": "abilities",
        "id": "ability-045"
      },
      "target": {
        "collection": "effects",
        "id": "sandstorm"
      },
      "trigger": "on-entry"
    }
  },
  {
    "available": true,
    "id": "ability-070--weather--harsh-sunlight",
    "identity": true,
    "rule": {
      "parameters": {
        "duration": {
          "turns": 5
        }
      },
      "recipient": "field",
      "relation": "causes",
      "requirements": {
        "all": []
      },
      "source": {
        "collection": "abilities",
        "id": "ability-070"
      },
      "target": {
        "collection": "effects",
        "id": "harsh-sunlight"
      },
      "trigger": "on-entry"
    }
  },
  {
    "available": true,
    "id": "ability-117--weather--snow",
    "identity": true,
    "rule": {
      "parameters": {
        "duration": {
          "turns": 5
        }
      },
      "recipient": "field",
      "relation": "causes",
      "requirements": {
        "all": []
      },
      "source": {
        "collection": "abilities",
        "id": "ability-117"
      },
      "target": {
        "collection": "effects",
        "id": "snow"
      },
      "trigger": "on-entry"
    }
  },
  {
    "available": true,
    "id": "ability-146--benefits--sandstorm",
    "identity": true,
    "rule": {
      "parameters": {
        "multiplier": 2,
        "stat": "speed"
      },
      "recipient": "self",
      "relation": "benefits",
      "requirements": {
        "all": [
          {
            "effectId": "sandstorm",
            "predicate": "effect-active"
          }
        ]
      },
      "source": {
        "collection": "abilities",
        "id": "ability-146"
      },
      "target": {
        "collection": "effects",
        "id": "sandstorm"
      },
      "trigger": "while-active"
    }
  },
  {
    "available": true,
    "id": "ability-202--benefits--snow",
    "identity": true,
    "rule": {
      "parameters": {
        "multiplier": 2,
        "stat": "speed"
      },
      "recipient": "self",
      "relation": "benefits",
      "requirements": {
        "all": [
          {
            "effectId": "snow",
            "predicate": "effect-active"
          }
        ]
      },
      "source": {
        "collection": "abilities",
        "id": "ability-202"
      },
      "target": {
        "collection": "effects",
        "id": "snow"
      },
      "trigger": "while-active"
    }
  },
  {
    "available": true,
    "id": "ability-226--weather--electric-terrain",
    "identity": true,
    "rule": {
      "parameters": {
        "duration": {
          "turns": 5
        }
      },
      "recipient": "field",
      "relation": "causes",
      "requirements": {
        "all": []
      },
      "source": {
        "collection": "abilities",
        "id": "ability-226"
      },
      "target": {
        "collection": "effects",
        "id": "electric-terrain"
      },
      "trigger": "on-entry"
    }
  },
  {
    "available": true,
    "id": "ability-227--weather--psychic-terrain",
    "identity": true,
    "rule": {
      "parameters": {},
      "recipient": "field",
      "relation": "causes",
      "requirements": {
        "all": []
      },
      "source": {
        "collection": "abilities",
        "id": "ability-227"
      },
      "target": {
        "collection": "effects",
        "id": "psychic-terrain"
      },
      "trigger": "on-entry"
    }
  },
  {
    "available": true,
    "id": "ability-229--weather--grassy-terrain",
    "identity": true,
    "rule": {
      "parameters": {},
      "recipient": "field",
      "relation": "causes",
      "requirements": {
        "all": []
      },
      "source": {
        "collection": "abilities",
        "id": "ability-229"
      },
      "target": {
        "collection": "effects",
        "id": "grassy-terrain"
      },
      "trigger": "on-entry"
    }
  },
  {
    "available": true,
    "id": "harsh-sunlight--damage--fire",
    "identity": true,
    "rule": {
      "parameters": {
        "multiplier": 1.5
      },
      "recipient": "matching-moves",
      "relation": "boosts",
      "requirements": {
        "all": []
      },
      "source": {
        "collection": "effects",
        "id": "harsh-sunlight"
      },
      "target": {
        "collection": "moves",
        "selector": {
          "typeId": "fire"
        }
      },
      "trigger": "damage-calculation"
    }
  },
  {
    "available": true,
    "id": "harsh-sunlight--damage--water",
    "identity": true,
    "rule": {
      "parameters": {
        "multiplier": 0.5
      },
      "recipient": "matching-moves",
      "relation": "reduces",
      "requirements": {
        "all": []
      },
      "source": {
        "collection": "effects",
        "id": "harsh-sunlight"
      },
      "target": {
        "collection": "moves",
        "selector": {
          "typeId": "water"
        }
      },
      "trigger": "damage-calculation"
    }
  },
  {
    "available": true,
    "id": "item-149--cures--paralysis",
    "identity": true,
    "rule": {
      "parameters": {
        "usesPerBattle": 1
      },
      "recipient": "holder",
      "relation": "cures",
      "requirements": {
        "all": []
      },
      "source": {
        "collection": "items",
        "id": "item-149"
      },
      "target": {
        "collection": "effects",
        "id": "paralysis"
      },
      "trigger": "on-status"
    }
  },
  {
    "available": true,
    "id": "item-150--cures--sleep",
    "identity": true,
    "rule": {
      "parameters": {
        "usesPerBattle": 1
      },
      "recipient": "holder",
      "relation": "cures",
      "requirements": {
        "all": []
      },
      "source": {
        "collection": "items",
        "id": "item-150"
      },
      "target": {
        "collection": "effects",
        "id": "sleep"
      },
      "trigger": "on-status"
    }
  },
  {
    "available": true,
    "id": "item-151--cures--bad-poison",
    "identity": true,
    "rule": {
      "parameters": {
        "usesPerBattle": 1
      },
      "recipient": "holder",
      "relation": "cures",
      "requirements": {
        "all": []
      },
      "source": {
        "collection": "items",
        "id": "item-151"
      },
      "target": {
        "collection": "effects",
        "id": "bad-poison"
      },
      "trigger": "on-status"
    }
  },
  {
    "available": true,
    "id": "item-151--cures--poison",
    "identity": true,
    "rule": {
      "parameters": {
        "usesPerBattle": 1
      },
      "recipient": "holder",
      "relation": "cures",
      "requirements": {
        "all": []
      },
      "source": {
        "collection": "items",
        "id": "item-151"
      },
      "target": {
        "collection": "effects",
        "id": "poison"
      },
      "trigger": "on-status"
    }
  },
  {
    "available": true,
    "id": "item-152--cures--burning",
    "identity": true,
    "rule": {
      "parameters": {
        "usesPerBattle": 1
      },
      "recipient": "holder",
      "relation": "cures",
      "requirements": {
        "all": []
      },
      "source": {
        "collection": "items",
        "id": "item-152"
      },
      "target": {
        "collection": "effects",
        "id": "burning"
      },